{
  "workspace": {
    "name": "Spring KFZ Workshop Management System",
    "description": "C4 Model for a Spring Boot-based automotive workshop management system"
  },
  "persons": [
    {
      "name": "Customer",
      "description": "Vehicle owners who book appointments and services through the system",
      "relations": [
        {
          "target": "Spring KFZ System",
          "type": "Books appointments and views services through"
        }
      ]
    },
    {
      "name": "Admin",
      "description": "Workshop administrators who manage appointments, services, and system configuration",
      "relations": [
        {
          "target": "Spring KFZ System",
          "type": "Manages appointments and configuration through"
        }
      ]
    },
    {
      "name": "Mechanic",
      "description": "Workshop mechanics who receive appointment notifications and updates",
      "relations": [
        {
          "target": "Spring KFZ System",
          "type": "Receives notifications from"
        }
      ]
    }
  ],
  "softwareSystems": [
    {
      "name": "Spring KFZ System Web",
      "description": "Automotive workshop management system for appointment booking, service management, and car card display",
      "relations": [
        {
          "target": "Email Service",
          "type": "Sends notifications via"
        },
        {
          "target": "MySQL Database",
          "type": "Stores data in"
        },
        {
          "target": "File System",
          "type": "Stores images in"
        }
      ]
    },
    {
      "name": "Email Service",
      "description": "External SMTP service for sending email notifications",
      "relations": []
    },
    {
      "name": "MySQL Database",
      "description": "Relational database for storing all application data",
      "relations": []
    },
    {
      "name": "File System",
      "description": "Local file storage for car images and uploads",
      "relations": []
    }
  ],
  "containers": [
    {
      "name": "Web Application",
      "description": "Spring Boot REST API providing endpoints for workshop management",
      "technology": "Spring Boot, Java 21",
      "relations": [
        {
          "target": "MySQL Database",
          "type": "Reads from and writes to"
        },
        {
          "target": "Email Service",
          "type": "Sends emails via"
        },
        {
          "target": "File System",
          "type": "Stores and retrieves files from"
        }
      ],
      "softwareSystemName": "Spring KFZ System"
    },
    {
      "name": "Security Layer",
      "description": "Spring Security configuration for authentication and authorization",
      "technology": "Spring Security",
      "relations": [
        {
          "target": "Web Application",
          "type": "Secures"
        }
      ],
      "softwareSystemName": "Spring KFZ System"
    }
  ],
  "container": [
    {
      "webApplication": {
        "objectMapper": [
          {
            "componentName": "Admin Controller",
            "tags": "Controller",
            "technology": "Spring MVC",
            "description": "Handles admin-specific operations for appointments, services, time slots, and car cards",
            "relations": [
              {
                "target": "Appointment Service",
                "type": "uses"
              },
              {
                "target": "Time Slot Service",
                "type": "uses"
              },
              {
                "target": "Service Item Service",
                "type": "uses"
              },
              {
                "target": "Car Card Service",
                "type": "uses"
              },
              {
                "target": "Service Site Service",
                "type": "uses"
              },
              {
                "target": "Email Service",
                "type": "uses"
              }
            ]
          },
          {
            "componentName": "Appointment Controller",
            "tags": "Controller",
            "technology": "Spring MVC",
            "description": "Manages customer appointment booking and status updates",
            "relations": [
              {
                "target": "Appointment Service",
                "type": "uses"
              },
              {
                "target": "Email Service",
                "type": "uses"
              }
            ]
          },
          {
            "componentName": "Authentication Controller",
            "tags": "Controller",
            "technology": "Spring MVC",
            "description": "Handles user authentication, login, logout, and session management",
            "relations": [
              {
                "target": "User Service",
                "type": "uses"
              }
            ]
          },
          {
            "componentName": "Car Card Controller",
            "tags": "Controller",
            "technology": "Spring MVC",
            "description": "Displays available cars for sale with specifications and images",
            "relations": [
              {
                "target": "Car Card Service",
                "type": "uses"
              }
            ]
          },
          {
            "componentName": "Service Controller",
            "tags": "Controller",
            "technology": "Spring MVC",
            "description": "Provides endpoints for available workshop services",
            "relations": [
              {
                "target": "Service Item Service",
                "type": "uses"
              }
            ]
          },
          {
            "componentName": "Service Site Controller",
            "tags": "Controller",
            "technology": "Spring MVC",
            "description": "Manages service site content and descriptions",
            "relations": [
              {
                "target": "Service Site Service",
                "type": "uses"
              }
            ]
          },
          {
            "componentName": "Time Slot Controller",
            "tags": "Controller",
            "technology": "Spring MVC",
            "description": "Manages available appointment time slots",
            "relations": [
              {
                "target": "Time Slot Service",
                "type": "uses"
              }
            ]
          },
          {
            "componentName": "Admin Auth Controller",
            "tags": "Controller",
            "technology": "Spring MVC",
            "description": "Handles admin-specific authentication and credential management",
            "relations": [
              {
                "target": "Admin Credential Service",
                "type": "uses"
              }
            ]
          },
          {
            "componentName": "Appointment Service",
            "tags": "Service",
            "technology": "Spring Service",
            "description": "Business logic for appointment management, validation, and status updates",
            "relations": [
              {
                "target": "Appointment Repository",
                "type": "uses"
              },
              {
                "target": "Time Slot Repository",
                "type": "uses"
              },
              {
                "target": "Appointment Mapper",
                "type": "uses"
              }
            ]
          },
          {
            "componentName": "Time Slot Service",
            "tags": "Service",
            "technology": "Spring Service",
            "description": "Manages available time slots for appointments, including creation and availability checking",
            "relations": [
              {
                "target": "Time Slot Repository",
                "type": "uses"
              },
              {
                "target": "Time Slot Mapper",
                "type": "uses"
              }
            ]
          },
          {
            "componentName": "Service Item Service",
            "tags": "Service",
            "technology": "Spring Service",
            "description": "Manages workshop services including popular services and service operations",
            "relations": [
              {
                "target": "Service Repository",
                "type": "uses"
              },
              {
                "target": "Service Mapper",
                "type": "uses"
              }
            ]
          },
          {
            "componentName": "Car Card Service",
            "tags": "Service",
            "technology": "Spring Service",
            "description": "Manages car listings with image processing and storage",
            "relations": [
              {
                "target": "Car Repository",
                "type": "uses"
              },
              {
                "target": "Car Spec Repository",
                "type": "uses"
              },
              {
                "target": "Image Service",
                "type": "uses"
              },
              {
                "target": "Car Card Mapper",
                "type": "uses"
              }
            ]
          },
          {
            "componentName": "Service Site Service",
            "tags": "Service",
            "technology": "Spring Service",
            "description": "Manages service site content and information",
            "relations": [
              {
                "target": "Service Site Repository",
                "type": "uses"
              },
              {
                "target": "Service Site Mapper",
                "type": "uses"
              }
            ]
          },
          {
            "componentName": "User Service",
            "tags": "Service",
            "technology": "Spring Service",
            "description": "Handles user management and authentication operations",
            "relations": [
              {